{
  "schemaVersion": "1.0.0",
  "projectId": "change-me",
  "lifecycleMode": "full",
  "state": "MIGRATION_PENDING",
  "pendingApproval": null,
  "decisionRefs": [],
  "activeProfiles": [],
  "profileResolutionPath": "harness/generated/profile-resolution.json",
  "migration": {
    "fromVersion": "11.0.0",
    "proposedProfiles": [],
    "notes": "Set projectId, choose proposedProfiles, resolve profiles, review baselines, then approve migration."
  },
  "history": []
}
